{
  "$schema": "https://json-schema.org/draft/2020-12/schema",
  "$id": "urn:content:region",
  "title": "区域",
  "type": "object",
  "additionalProperties": false,
  "required": ["id", "displayName", "asset", "player"],
  "properties": {
    "id": { "$ref": "urn:content:common#/$defs/regionId" },
    "displayName": { "$ref": "urn:content:common#/$defs/displayName" },
    "asset": {
      "type": "object",
      "additionalProperties": false,
      "required": ["model"],
      "properties": {
        "model": { "type": "string", "minLength": 1 },
        "navmesh": { "type": "string", "minLength": 1 }
      }
    },
    "player": {
      "type": "object",
      "additionalProperties": false,
      "required": ["id", "templateId", "displayName", "spawn", "baseAttributes"],
      "properties": {
        "id": { "$ref": "urn:content:common#/$defs/entityId" },
        "templateId": { "$ref": "urn:content:common#/$defs/templateId" },
        "displayName": { "$ref": "urn:content:common#/$defs/displayName" },
        "spawn": {
          "type": "object",
          "additionalProperties": false,
          "required": ["position"],
          "properties": {
            "position": { "$ref": "urn:content:common#/$defs/vec3" },
            "rotation": { "$ref": "urn:content:common#/$defs/vec3" }
          }
        },
        "baseAttributes": { "$ref": "urn:content:common#/$defs/attributes" }
      }
    },
    "exits": {
      "type": "array",
      "items": {
        "type": "object",
        "additionalProperties": false,
        "required": ["id", "targetRegionId", "position"],
        "properties": {
          "id": { "type": "string", "pattern": "^exit:[a-z0-9_]+$" },
          "targetRegionId": { "$ref": "urn:content:common#/$defs/regionId" },
          "position": { "$ref": "urn:content:common#/$defs/vec3" },
          "rotation": { "$ref": "urn:content:common#/$defs/vec3" }
        }
      }
    },
    "safeZones": {
      "type": "array",
      "minItems": 1,
      "items": {
        "type": "object",
        "additionalProperties": false,
        "required": ["id", "shape", "center", "halfExtents"],
        "properties": {
          "id": { "$ref": "urn:content:common#/$defs/safeZoneId" },
          "shape": { "const": "rect" },
          "center": { "$ref": "urn:content:common#/$defs/vec3" },
          "halfExtents": {
            "type": "object",
            "additionalProperties": false,
            "required": ["x", "z"],
            "properties": {
              "x": { "type": "number", "exclusiveMinimum": 0 },
              "z": { "type": "number", "exclusiveMinimum": 0 }
            }
          }
        }
      }
    }
  }
}
